,content,score
0,自从小米出了接线板，家里、单位基本都换小米了，方便实用，品质有保障还不会，特别满意～使用率超级高，插这么多也不会发热,5
1,已经买了第三个了 便宜又好用 绝对是米粉 太喜欢小米的东西了 白白的显得很干净 推荐给身边很多朋友了 有的时候忘记带充电器来单位 随便找根数据线就可以充电 很方便,5
2,入手第一感觉重，说明用材好，插头插上去紧，不会像很多插座松松垮垮的，三脚两脚并重，非常方便，usb用了下也很方便，但充电还是用手机自己接头快。,5
3,小米的做工一如既往的不错啊，也很漂亮，最重要的是非常的实用啊，质量很好，方便手机充电，方便@头，不错不错,5
4,"非常给力 比我想象的好多了！省了不了的插孔 usb非常快 家里老式的插排可以淘汰了,以后家里要用到排插的时候还会考虑这款的！美中不足的是线太短不能自行选购 如果线有5米的就好了！不多说好评 一直以来都相信京东！",5
5,相信小米的品质，这款形状细长，小巧，不占地方，又能插很多插头，USB快充也很好用，很满意！,5
6,小米充电插座可以呀，质量很棒，usb2a快充这一方面已经很不错了。线有一米八左右很合适，京东物流快的很开心！加油,5
7,非常好用，漂亮，六个插孔，三个UBS.小米的插排还是灰漂亮的。灰常推介大家购买。绝对不会后悔的。质量应该超级好。,5
8,功能强大，我表示很好用，就是建议买长一点的线，有可能不够用。线很粗用料很扎实，货真价实，品质值得信赖。,5
9,非常好用的插座，很喜欢啊。一波三折，先买的，结果降价了，申请价保给弄错了，差点退货了。很喜欢这个排插，质量很好，虽然快充不怎么给力，但是设计简洁，黑色经典耐看，真的很棒，好评好评,5
10,质量特别棒，这个设计很好，非常的人性化。老公很喜欢，多次购买。usb接口挺多的。凑字走起，要想打造一个完美深邃的五官，光有修容是不够的，你还需要高光，高光可以使看起来比较死板的妆容，变的有光泽，你的面部就不会显得黯淡扁平,5
11,非常不错，真的。材质，手感超级舒服。虽然只是个插座&hellip;这个感觉摸着让人感到安全感。真的，沉沉的。线不长不短刚刚好，造型精致小巧精致的感觉。喜欢！,5
12,物流很快，收到打开试用，总长1米8够长，三个擦位，三个USB 输出，很方便，还有个电源开关键，挺好用的，支持卖家，给好评，先用一段时间再来追加评论。,5
13,小米的插排很好用 黑色的很酷 有三个usb接口 平时用来充电很方便另外还有三个电源孔 放在床头满足日常的需要 不错 还有单独的电源开关 满意,5
14,"满意回答
质量非常好，与卖家描述的完全一致，非常满意,真的很喜欢，完全超出期望值，发货速度非常快，包装非常仔细、严实，物流公司服务态度很好，运送速度很快，很满意的一次购物",5
15,线材不错很好！很粗大 很有感觉 总体用了一个小时 体验还不错 长度够用 ！好评,5
16,买手机什么的都是买的小米的，感觉非常不错，本来想买个充电器的，但是后来想想在家中的，不需要带带走，所以买了一个价格比充电器高一点的插线板，2500W的，挺好，这个插线板是正品，很有分量。,5
17,质量不错，外观也漂亮，使用很方便，特别是充电更方便，真材实料的！,5
18,非常不错的插线板，有好几个US_B口，可以给好几个手机同时充电了。同时还满足了落地台灯等其它用电器的需求。,5
19,漂亮的小米白，颜值控的首选，还没有用就已经很喜欢了！需要下载一个app，就可以手机遥控了！,5
20,不错不错，外观确实是见过的最美的插座，没有之一!简洁大方，将充电器插进去弹簧力度适中。两米的长度，也是设计的很讨巧的，大部分家里用的两米足够了!,5
21,非常非常的满意 超出了我的预期价格又便宜 以后准备再买一个 放在老家 嗯 朋友们看了都觉得挺好的 以后要买就买这个 性价比比较高,5
22,小米的东西一直都很满意，这款插板样子简单看起来很舒服，专门手机充电的usb插头很好用！暂时没有发现其他问题！,5
23,已经用了段时间，没出过问题，感觉还是质量不错，三个usb接口还是很方便，不用天天拔插头了，黑色经脏，希望能用很长时间！,5
24,很不错吧，远程智能控制，电量统计，也可以实时查看电器功率。家里有四个同款了。,5
25,插线板挺沉，看的质量挺好，很早以前就想买了，功能很全。插线板现在智能了，想关闭关闭，想开起开启，这个配置wifi也很简单，操作功能也很简单，app绑定插线板也很简单，总之买这款插线板真值,5
26,效果错的看得挺简洁的物流速度很快的快递员态度也挺好的刚用感觉不错的，用好了还会再来买的！总开关也设计挺好的但是不知道以后这个摁键能不能效果一直好用，管他呢！先用一用再说吧！,5
27,之前买了一个小米插线板，这又买了一个，带usb充电，特别方便，充电也快，很好。之前买了一个小米插线板，这又买了一个，带usb充电，特别方便，充电也快，很好。之前买了一个小米插线板，这又买了一个，带usb充电，特别方便，充电也快，很好。,5
28,不错，做工手感舒适，顺滑，充电速度不错，省了充电头，很完美，不大不小，安全，小米生态链越来越棒了。不错。,5
29,太喜欢京东了，着急用插排，当天晚上就拿到了。质量很好，性价比也高！！没有usb接头我也不怕不怕啦,5
30,包装很不错啊，送货也很快，至于那些说USB充电很慢的人不知道怎么回事。反正我用了几天觉得很好充电速度一点都不慢，一边充一边玩毫无压力。,5
31,功能非常强大，用的非常舒服，对于家庭少插座的用户，非常合适，充手机，插空调，都合适，不过最大电流输出是十安。小米，依然是最具性价比的产品，顶顶。,5
32,小米的配件一直都特别好用，很喜欢，质量很好，做工不错，细节做的很到位，用了一段时间，都没有出什么问题,5
33,不错，外观很好看，最喜欢小米家的简洁设计，因为经常放地上所以选了黑色，很实用，物流也很快，客服也很有耐心，所以完全不用担心什么，总是这是一次很满意的购物经历，下次还会再光顾的～,5
34,"真的好想要
真的受不了
看看你的小蛮腰实在受不了
usb单口2A 日常够用 
颜值爆表哟",5
35,家里的插线板基本都是小米的做工很好，份量十足非常不错，小米国货精品，家里基本都被小米承包了,5
36,用来控制家里的电脑，可以实现远程开关机的。自己在外面控制插座即可，很方便。京东一如既往的优秀。,5
37,很好，没有电流声，电源灯也也非常低调，晚上睡觉也不受影响。因为是放在床边的飘台上，很怕有声音或者电源灯太亮影响睡眠，小米的质量还是很可以的。,5
38,非常的完美，从桌子上可以看出我所有的东西都是小米的，因为他的东西比较，性价比，高。而且做的比较的简约漂亮，比较符合现代科技感的风格，所以说比较喜欢，一直会支持小米。,5
39,非常实用，孩子房间有这么一个插线板就完全够用了，而且相信小米的品质，家里大大小小小米的东西越来越多。,5
40,很不错的插线板，小巧可爱，很精致，很漂亮，不错，尤其底下的USB插头很实用，小米的产品值得信赖，算是忠实的米粉了,5
41,"用过小米的插座，紫米的充电宝，说说这款产品的感受:
1.外观，用料考究，做工精良
2. WiFi链接稳定，反应灵敏，定时、时段关机功能很实用
3. App友好，用电器功率，用电量一目了然
缺点:使用一周，暂时没有发现
总结:第一次用智能插座，定时关机，时段开关功能很实用，物有所值（69），推荐购买",5
42,特别好！小米的东西真的是闭着眼睛买，做工好 外观美 设计合理 做工精致 价格还公道！,5
43,还不错   很适合宿舍用   一个电脑    一个台灯   一个手机充电器    三个usb还可以给充电宝充充电   usb风扇等    家用也不错  线材很粗    做工比大街上几十块的杂牌插线板好很多。总体来说  颜值挺高   50块钱还是可以的,5
44,黑色不错，放在显示器架子下面，不会显得很突兀，而且省去了电视盒、音箱的电源，直接用线接就好了。小米性价比高啊。,5
45,之前买的坏了，3个usb都不能用了，申请售后马上就给换了一个非常好。一如既往的相信京东的售后，绝对无敌。另外这个产品也不错，3个口充电很方便非常好。颜值也很高。,5
46,一开始在超市去买，看了一下，差的看不上，好的一个七八十，准备买的，后来一想，网上应该便宜些，就在网上买了这款，和超市里面有一样好，还便宜几十块钱，从来没买过小米的手机，在网上看到说小米的手机便宜，实惠，所以就买了这款，果然很好。,5
47,漂亮的妙不可言，能把插座做成这样，技术人员很有品味，而且五米的线也足够长，整套房子无死角！小巧轻便，插板没有一点多余没必要的空余！有用的很！,5
48,小米插座分量很足，手   感很好，电视、IPTV、**盒子，三个插孔正好，排列也合理，非常满意！送货员态度很好，很赞！！！,5
49,小米插线板不错，买来给我妈用的，usb接口可以给小米手电筒，充电宝，这些东西充电使用，就不用买充电头了，宝贝非常好！值得购买。,5
50,拖线板外观十分好看，简约大方而且功能很全，带USB接口充电，光靠一根数据线就可以充电啦，很快捷。电脑端的USB充电实在是太慢了，现在不用充电头子也能充电，很方便。有个总开关控制，比较安全。之前用的大功率的取暖器，过不了多久开关就会自动关闭，安全系数高。总的来说很不错,5
51,这个插线板用起来还蛮舒服的，有三个接头可以直接采用usb，所以很方便，放在桌子上，黑色也显得，很酷。,5
52,满意，物流挺快的，放床头非常方便，冲台灯手机都不许充电头了，孔位很多，晚上显示灯亮着还可以当小夜灯用。最重要是小米大牌子放心,5
53,"插板挺有分量的，和那种廉价的感觉很不一样，开关上的灯挺好看的，白色的和插板很配，宿舍一个绝对够了，也不会显得乱，三个口都是快充就很nice             
                                                                           一个资深米粉",5
54,第一次看到这么漂亮的插板，竟然有三孔，有两孔，数据线充电口。刚才用了我的iphone手机充电相当的快。安全系数还是很高的。美观第一。,5
55,做工不错，而且很小巧，放在床头柜上一点也不占地方，而且还带usb口充电很方便。,5
56,常常网购，总有很多的包裹收，感觉写评语花掉了我很多的时刻和精力!所以在一段时刻里，我总是不去点评或许随意写写!可是，我又总是觉得如同有点对不住那些辛苦工作的卖家客服、仓菅、老板。于是我写下了一小段话，给我觉得能拿到我五星好评的卖家的宝物点评里面以示感谢和尊敬!首要，宝物是性价比很高的，我每次都会先试用再点评的，尽管宝物纷歧定是最好的，但在平等的价位里面肯定是体现最棒的。~的配送肯定是一流的，送货速度快，配送员效劳态度好，每样东西都是送货上门。希望京东能再接再厉，做得更大更强，供给更多更好的东西给我们。,5
57,非常好看且实用的插排，颜值高，功能实用，充电快，安全系数高，线材用料厚实，非常不错，并且开关灯光非常柔和，不会刺眼，100分。,5
58,买了两个，一个送人了，一个自己用，挺好用的，并且颜值也可以，很好看，质量也可以，哈哈哈,5
59,可以的，很强势啊，我现在都不知道怎么用手机看的什么，小米插排，好，很好啊，比较洋气啊，哈哈,5
60,外表看起来干净立正，整个形态也不是很占地方。挺好看也好用的插排，价格也不贵。USB口给一些小仪器充电也都很方便，好评！,5
61,小米插线板仅铅笔盒大小，配备3组国际插孔、3个USB充电口(总电流3.1A，单口支持2A快充)、支持110-240伏电压，插线板采用定制的乔日三合一过载保护开关，3组带保护们的国际插孔，750℃高阻内燃外壳。真的非常喜欢啊。,5
62,一个插线板竟然这么高的颜值，侧面漆面设计很apple，但又是小米亲人的价格，可以说很喜欢了。LED指示灯无光污染存在，非常赞。配合小米45w电源，颜值很高了,5
63,已经收到啦小米插线板，感觉很好用，外观简洁，漂亮，做工很好，关键是才9块钱买的，我还要啥自行车，好评哈哈,5
64,这个产品的便利性是肯定很大的，对于我这样设备很多的人来说，这样的产品刚刚好满足我的需求，而且，米家的东西，质量是真的过关的，就是我怀疑京东给我发的这个东西是别人退货的（二手）因为我刚拿到手就觉得这个包装很脏，还有破损，像被拆过一样的，而且这些脏东西还是在包装里面的（视频拍出来了）因为急着用，就算了，反正用着也挺好的,5
65,很好！买这个之前选的是公牛，3天就烧了，然后换货，一天就烧了，果断退货！用了一个礼拜了，很不错，插孔的设施比较合理！平板和手机同时充电也可以插得下（我自家的抽头不行）,5
66,小米的东西一如既往的没问题。服务好，物流快，包装结实，服务态度很好。带ubs插口，是正品，无色差，便捷设计简约大方，排插开关独立，很实用，家里的电器现在基本都是小米的了。物美价廉还可以，接线板看着很有质感当给力。简洁大方实用，比以前方便多了，不用再给手机插头排位置，充电也挺快的插座孔道够多，很方便使用。拿在手里很有质感。当时收到的箱子超级大，原来是保护措施。性价比很高，颜色很漂亮，比超市便宜，有品质保障。好用安全，家里，单位里全用小米的。好比公牛的便宜，质量也好，简洁时尚，小巧占空间小。目前也没有出现品质问题，不用犹豫入了不亏，性价比很高，值得入手。,5
67,很好的商品，很有艺术感，精致大气，很显档次，很不错的宝贝，手感不错，安全设计棒棒的，安全门很紧实，不用力还有点难拔出插头，家有小孩的是不错的选择，USB插口很满意，我充电就没用充电器头了，为生活增加了几分档次。快递很快，很满意的一次购物！,5
68,物流很快。第二天就到了。东西很好。小米的东西很精致。功能也是好用的。等于6个插座了。体积又小。不占地方。,5
69,一直支持小米，从小米手机，小米手环2到现在的小米插线板，信赖小米，信赖京东自营店！从外观来看小米插线板小巧精致，仅仅只有铅笔盒大小，插头也比其他产品小很多，而且还有过载保护和极速断电，再也不用怕插线板烧坏了！线也够长足有1.8米！很方便！还有3个usb口支持5V-2.1A再也不用担心充电头不够用了！,5
70,"京东一如既往地快，很迷你，不占地方，1m的线比我想象的短，但却是我这刚好够用的长度，一点都不浪费，好评。
外观上，白色简约，按键小巧，插孔有防尘，很精致；插孔的间距合理，不至于插了以后很挤",5
71,比想象中的要好很多，包装也很好看，插座也是非常好看，做工也很好，有了这插座晚上上班就方便很多了，把时间定好，晚上起床前就自动开关灯，非常方便，还有功率检测，这下知道什么电器耗电了，还有电量统计，总之这款非常不错，有活动再买几个，把别的电器都改智能的，,5
72,小米做的东西外观都给人一种简洁大方，插线板已经回购好多次了，用起来安全很适合家里有宝宝的，又能直接给手机充电，价格还可以，东西的包装很干净也很严实，就物流而言，物流确实很给力，增加了消费者购物的体验感，好评。,5
73,一直很信任小米的产品，以前的手机和平板，手环都是用小米的。拖线板能满足我的需求，蓝牙耳机充电，蓝牙音箱充电，配套的都是USB接口充电线，每次找个充电头很不方便，遇到手机也要充电的话就很尴尬了。这下好了米家这款有六个插头，三个USB接口。手机充电，笔记本充电，台灯插头，蓝牙耳机、音箱充电，小夜灯都可以满足了。,5
74,支持小米mi！！不错不错！物流很快，1天就到了！~物流很快！信仰充值成功！3个usb输出，而且支持2．0A输出，最大功率2x5＋1X5＝15W，充电速率很快，可以不用充电头了！而且外观很棒！完全符合我的审美，很好看的白色！小米真的越做越好了！期待小米能做更好的产品！支持！,5
75,黑色，够酷够炫，打破传统，打破常规，家人一看就喜欢，大赞。三个USB 插口，充电可以直接用，特别赞！几个插口可以同时用，再也不需要拔掉在用的充电了。推荐购买！推荐购买！,5
76,家里全部都是小米插线板，看看这线很粗，安全，价格便宜，现在又可以快速充电，满意。京东物流一如既往的流弊，昨晚11点多下单，第二天上午送到。目前只有京东物流送到打电话请收货，其他的都是渣。,5
77,小米插线板，不可思议，做工精美手感舒适，像个工艺品，功能强进，可连接路由器和手机，实现遥控开关，延时预约计量等诸多功能，非常强大，已经安装好了，手机app安装也十分简单，还没开始使用，日后再评！,5
78,小米的产品确实做工精细，小米生态链出品，插线板属于MINI的，很巧很可爱，线很粗，比公牛的都粗，拿在手上感觉很有份量，说明用料好，用起来放心哈，电源开关也小心的，灯光有点偏暗，还好我视力很好，用起来也没有任何障碍哈，可能设计师的理念是暗一点有情调，三个USB接口非常给力，试用了一下，苹果手机10分钟可以充15%的电，相当给力了，京东物流速度很快，自提点的大哥很帅，服务态度很好，点赞,5
79,很耐用，很漂亮，很精致，品质感很好，而且还配有USB插口，充电特别方便。,5
80,线够长，质量优秀！防中电做的非常好！白色不过挺耐脏，不用经常打理，小米家的产品还是非常信任的,5
81,使用了一段时间再做评价的。做工精细，简洁轻巧、小巧美观，安装简单，性价比高，插头端口多样性，非常方便实用，手机、iPad等电子产品充电时再也不用抢着用了。,5
82,非常不错 插进去 拔出来 尺寸正好 还很紧 对 相当紧 插进去好几次都还不松 估计用很久都还行 比上次的明显好 不是二手 没有全部插进去 试了几个洞 赞小米,5
83,同时推荐买小米插座，带USB口的既可以用数据线直充，还可以带座插口，虽然我用的是小米无线充，但是也很好用，给家里也带了两个，值得推荐,5
84,宝贝很满意，小米做工还是比较良心的，颜值高，质量也很好，一直在忙忘记评论了，sor。ps：底部有可以挂在墙上的，只是我没有挂,5
85,质量很不错，看上去很高档！雷总确实良心商人，直接拉高了行业水平，降低了产品价格！滋磁雷总！Are you OK?,5
86,简约，美观，时尚。精致。安全，品质，保障。快递很快，U爱死B接口做工非常精细。,5
87,小米的东西是真的好用啊，方便实惠，这个插线板很小，不占地，但麻雀虽小，五脏俱全，功能特别强大，保护充电器，还有插线板微微发热属正常现象，不用在意，总之，一个字：棒！（ps：图为插线板和一卷卫生纸的大小）,5
88,这个插座，插销插进去很费劲，不过USB接口确实非常有用，节省空间！我其他的插座都是分控的4个，手机，pad，台灯，就不够用了。这个3+3=6，觉得也挺合适，让我多买的充电插头都没有用武之地了。。。,5
89,接口排列紧凑，间隙正好，双动保护门：六位国标组合电源插孔，每一位插孔均能适用国标三扁插头、国标两扁插头、德标4.8mm直径两圆插头，插孔有防尘设计，新的电源开关更精致、安全，整体做工很不错！白色插线板更耐看，指示灯够亮，比公牛精致多了！,5
90,还可以，家里买了好几个了，用着比较方便，也很小巧，白色的也很好看，放哪儿都行，主要是小巧耐用，我觉得就可以了，USB口三个总功率小了点儿，嗯，还可以,5
91,&hellip;小米的插线座&hellip;感觉小米什么产品都做呢，这个插线板很厚实，主要是看中了上面带有usb接口了，很方便可以链接许多数码设备。,5
92,最爱小米，手机，电视，现在连插排都用上小米的了。小米产品，一用就上瘾，中毒，接下来说说插排，本人很喜欢黑色，黑色的巨好看，插得时候有点紧，毕竟第一次嘛，紧了也好，不容易掉，喜欢喜欢喜欢，重要的事情说三遍,5
93,插排很好用！整体质感，形象我都很喜欢！看着我就喜欢！用还蛮好用的！而且可以直接不用插头充电，虽然我插头很多，但是有usb口我还是很喜欢的！赞(/RQ/),5
94,挺好用的，放在实验室，给手机和平板充电很方便。 有那种usb小灯、小风扇也可以直接插上去，很舒服。 只是有点担心白色的不耐脏，侧面的保护膜我还没揭,5
95,小米插排，质量、做工精致、高档感、艺术美感强！多重安全设计，用得安心，最怕短路或者伤害我的电脑等电器。 充电口，提供的电源大小，使用时候要选适合的电子产品。 我家里有的插头变异的大，导致一个插口被挤占、无法使用，遗憾。希望小米出8孔位的插排！,5
96,非常不错，重量比想象的重，应该是货真价实，用料好的缘故吧，以后旅行就带它了。不错不错！,5
97,是非常不错，是磨砂材质的^&omega;^，美观，充电相当的快，可以同时充三个设备，而且不要用快充头非常的方便,5
98,这小米智能电插板真好，质量很好，很美观，功能多，有三个USB插口，很实用，特方便，特省钱。给力。点赞小米！点赞京东！点赞##！点赞商家！点赞物流。好评！特别的好评！,5
99,黑色和白色都有了，黑白无常。白色手感细腻，黑色磨砂手感。插孔有安全挡板，比较紧，可以防止小孩乱弄，usb充电插口很方便。,5
100,优点:颜值高，质量感觉挺好的，线特别粗，有防触电装置，有脚垫，有u**插口，有开关，和开关指示灯插排很好用，喜欢小米的东西，再配合小米单插座，就更好控制了，一个总开关，一个分管开关，搭配小米网关和小爱音响等各个智能组件，打造智能家居，非常不错~,5
101,收藏了小米插板在购物车好久了，一直犹豫着要黑色还是白色，两个都喜欢，刚好有活动，到手价才三十多，实用，安全，五星好评，不错。,5
102,很好用，而且包装非常严谨，一看就很上档次，拿回家立马开始用，好方便啊，准备大规模换这种排插，因为有充电接口，方便手机充电，找根线就可以充了。使用一段时间看看，如果质量过关，就立马全线换。,5
103,非常好，是我想要的效果，用电脑特别的方便，晚上充电也很方便，省的大家都来找头,5
104,非常好，之前台式机用的小米3孔，质量非常好，漏电短路保护，入台机后孔不够用了，还是信赖小米，5孔的剩一个孔充电，非常不错，好评！,5
105,小米的排插还是可以的，做工很赞，全身看不到一个螺丝钉，做工甩某牛一条街，X牛同价位的质量做工用料都没这款好，而且款式又丑，基本都是N年前的造型。图三是之前买的（带3个USB接口），跟这款有点不同，但质量也是杠杠滴，用起来很有安全感，排插都是放枕头旁边，哈哈?,5
106,简洁、漂亮、美观、大方。使用体验很好，性价比高，推荐购买，目测线长有1.7米左右，个人感觉两米更加实用一些。当然了，综合体验很不错。在培训，电脑马上没电，解了燃眉之急。哈哈，京东物流真心不错。,5
107,小米的这类电器还是很靠谱的，买着也很放心。颜值很高，很纤细，不占地方。有usb很方便。线长度1.8m，放办公桌上面，接到地上的插线板很够用。,5
