,content,score
108,非常地好用，而且又美观，自从买了小米插线板之后，手机充电器我都不知道扔去哪了，哈哈哈,5
109,觉得这款比某牛的好，插头是通用的，某牛的还得自己换，太不方便了，这款还带有USB充电，比较实用,5
110,不得不说，这个插线板很好，带有三个USB接口，不用占插口的位置，可以腾出来给其它电器用，充电数据也不错，很快就能充满，主要的是颜值高、这个要承认，哈哈,5
111,小米插线板儿用的特别好，家里一个，公司一个。已经推荐给其他人购买了，特别棒。颜值也高，用得舒服。,5
112,今天是用的第二天，摸起来手感很好，比较沉，很有安全感。手机，台灯，笔记本，充电的设备比较多，五个插孔的能够用的比较从容。,5
113,这个小米插线板，做工很精美，很有艺术品的感觉，体积很小，不占地方，设计的三个多用插座带有保护盖，附带3个Usb，充手机、ipad，很方便，最大输出15w，2A快充，我很满意，买对了,5
114,非常好！！！满意！！！！主要是插头数量多，还有三个USB线接口，手机充电方便！！！好评！！！！,5
115,很棒，昨天收到就把办公室的光锚、路由和电话机、传真机、扫描伙等统一集中到一起，办公室的插线板一下子由零乱变得整齐了很多，颜值提升了不少，办公心情更舒畅了！,5
116,第二次买了，小米的产品设计很惊艳，性价比高。只是开关按钮感觉松松垮垮，尤其打到关的位置，按钮非常松，前后买的两个都是这样。鸡蛋里挑骨头，为了让小米更好！,5
117,"1.材料，耐温高，2.保护门,保护儿童，3.过载保护，电流超载是，保护器会自动切断电流，5.防雷，我自己用的是德国西门子的插线板，安全性能很好，外壳采用全PC阻燃材料，不易破碎，在品牌里性价比是很不错的。",5
118,太合适了，买一个插座，还有三个充电头单买一个头就要30块钱。高端大气上档次！选很粗用着放心，不错，准备再买一个五米长的。,5
119,外观简洁，秀外慧中，简单实用，还能远程控制，再也不用担心家里的用电器出险情了，睡觉前将电水壶插好，手机控制好预约时间，在你清晨起床时一壶清理体内垃圾毒素的温开水已经呈现在你身边，真的非常方便!还能记录用电量，细致入微啊！,5
120,包装很完美，精致简洁大方，实用性挺强，现在智能的东西多了，多几个充电孔没什么坏处，还没使用，先给个好评,5
121,很不错！外表真的是没得说，满分。电源插口都做了安全保护措施，好评！最重要的是有3个支持快充的usb口！！！充电速度很快。总之，是个很好的产品。,5
122,不错，手感很好，放在床头经常会碰，安全做的也很不错，需要很使劲才能完美插进去，防水肯定非常不错，就是电源开关感觉有点松，其他地方都不错。,5
123,包装中规中矩，放的很满当。线端插头真的比一般的小，我见过最小的了，可以防止和其他插头挤在一起。线也挺粗，整体质感也很好。就是那个防触电的插孔，很紧很紧。开关设计也不错，开启比较容易，关闭没那么随意，可以防止误碰断电。反正小米的东西线上线下都一个价，喜欢就可以了，使用没问题。,5
124,已经是第二次买了个插座了，体验非常好，手感摸上去很舒服，而且还有防漏电的功能，嗯，小孩摸不进去，值得拥有,5
125,第二次购买了，现在一个插线不够用，挺不错的，可以解放充电器了，为手机，平板充电毫无压力，非常好，好评,5
126,"不错的 总结下。Usb插孔很紧凑，插拔很舒服，充电速度也很不错
另外那个220v插孔很紧，特别是两孔的插口，得用点力，线很粗，开关手感一般。总的来说物美价廉，十分满意",5
127,以前买过小米插排，质量确实不错，线很粗，做工好，很好用，三个usb口省下来三个充电器，品质值得信赖，性价比高。这个还没拆开用，应该没问题,5
128,小米排插用过几个还不错，做工精美，简洁大方，设计的很好看，使用也方便，开关灵敏，手机充电方便，符合国家标准，安全放心。,5
129,这款小米电线板插座做工不错，设计简单，使用起来很方便，预定这款插座快递公司送货速度快，挺好的一款小米电线板插座!,5
130,外观简单大方，独立的U口，非常方便。京东物流还快，还比官网省了运费。还是安全插口。,5
131,插座用了很久，特别智能。能够远程控制，这是最大的亮点。也是非常吸引眼球的。配合米家App客户端，也有更多的实用功能和玩法。总而言之，这款米家智能插线板，外观漂亮，高大上，特别的简约风。推荐米粉购买哦～,5
132,京东快递快得离谱！插排质量很好，美观！今天买今天到！刚好鱼缸欠一个插排孔位，这个插排刚好五个孔位！适合用了,5
133,一口气买了两个，办公室和家里各一个，尤其是办公室，内外网电脑、打印机、扫描仪、无线路由器，排插上插得满满的，手机插头都没地儿插了，小米插座很小巧，不占地方，手机充电很方便。,5
134,这是我的出差神器，包里常备，因为经常出差，上面的U-S-B插口很方便，给手机充电、给充电宝充电，还不用带插头，so方便。,5
135,非常好 很实用 电子时代 usb简直是必备 小米这款设计非常好 而且黑色和其他的线在一起很搭 还禁脏 挺喜欢的 发货快 第二天就用上了 各种满意 以后还会继续选购,5
136,"非常 漂亮 完美的 插线板！完全可以摆在桌面上 观赏。
品质方面很好，未拆封的新品（公牛和小米同时下单的，可是公牛居然是被拆封了 二手的）
USB插口如果支持 QC 2.0 3.0 快充协议就更好了
毕竟5V 2.1A 实在是有点慢了&hellip;&hellip;

小米家 的 无线路由器 HD
小米家 的 WiFi放大器
小米家 的 4G无线路由器
小米家 的 蓝牙小钢炮
小米家 的 Yeelight床头灯
小米家 的 8H护颈乳胶枕
小米家 的 快充移动电源
小米家 的 扫地机器人
小米家 的 &hellip;&hellip;",5
137,质量好！囤货！我是京东的老顾客了。平时所有能在京东购买的东西都会在京东买！因为物流很快1天到，很方便。质量也有保证。只买自营的。,5
138,真的不错，这样省去老多充电头，挺方便的，做工也很好，真的很棒,5
139,和图片中的一样，不过产品保护细节做的非常好，插口处也套上了保护套，使用感觉不错很好,5
140,小巧，秀气，精致，经典白，我的最爱，多功能插座，很实用，用起来很顺心，小米的产品质量可靠，我喜欢。,5
141,对于小米这款插线板，个人非常满意，因为数码产品很多，需要充电的时候就非常纠结，这款的好处是有正常的插座孔，还有3个US_B孔，所以连充电插头都省掉了，也不会挤在一起，一共买了3个，出门旅游就随身带一个，非常方便,5
142,插线板简洁好看，也便宜，usb插口很方便，送货也快，很满意,5
143,第二次买了，质量很好，接口齐全，实用，小米性价比高！京东速度一流！,5
144,用了一段时间才评价的，真的很不错，买了一个以后又再买了一个，再也不担心没插头了，黑色很耐脏，总之很满意，物流也很快,5
145,家里原来有小米最早白色的，因为需要又买的黑色的，很原来比，线比原来粗，插头上没有米的标志，据说usb充电好像比开始简配了。,5
146,接线板放在阳台的休闲区，手机没电直接USB边充好电边看边喝茶，很赞。两排插孔设计也还合理，开关触点也很轻盈，小米东西还是不错的。,5
147,非常方便，不用手机充电头了。电流更稳定。米家智能电器，总有一款适合你,5
148,拿到手后，就挨个的功能都试用了一下，非常好用。功能齐全，还有就是使用的电器如果功率大了，它就直接断开，起到了断电保护的作用。非常安全。,5
149,实物和图片符合，外观很惊艳，超出了我的想象，原来即使一个不起眼的插排也可以做的如此美观。整体很小巧秀气，电源主线也超出了我的想象，主流水准到很柔软，这个超赞。还有有自带三个USB充电口，真心实用。至于大功率，可以承受10A的电流，完全不用担心一般的电器。整体来说做工很扎实，物美价廉。,5
150,嗯，米粉，没办法，太爱了，颜值高，体验过，功能强大，一下买了两个，又不会过度包装，环保，真的很不错，家里全是小米的东西。哈哈哈。。。。。,5
151,外型美观大方，设计简约而不简单，材料有质感。插孔较紧，与同等大小的其他品牌接线板相比，所用的线明显要粗一些，给人一种很放心的感觉。总体而言非常不错！,5
152,用了一个多月才来评价。总体很满意，外形很酷，电压也很稳，做工精致，很小巧，希望可以用久一点。插排这种东西，一定要买品牌，安全有保障。京东自营，正品保证！,5
153,买来放在办公室用的，非常合适，手机充电，电脑电源正正好好。小米的性价比也很高，非常合适。颜值就不多评价了，小米一贯的样式，简单干净。没有设计也会去最好的设计 喜欢,5
154,插线板不错?特别方便！之前买的好多电子产品没有配充电头，现在有了几个USB口，超级无敌好！以后的米3手环就可以方便充电,5
155,很好的插座，平时可以看看，养养心。。。。很不错，很好。可以的。下次还来。开关有点撇，性价比很高了。,5
156,小米的风格延续每一种产品，简单，整洁，大方，放在屋里任何地方都不会突兀。儿童仿触电的设计，老公还专门用筷子倒倒试试，倒不开，插销确能很轻松的插进去，很实用。一下子买了两个，收拾之后显得很简洁，以后会继续支持小米！京东物流也很快！,5
157,使用后，觉得不错，外观也漂亮，做工精致，可用来给手机直接充电，很方便。,5
158,小米排插第一次用，感觉非常满意，特别是安全功能很好，不会误触电，插座也紧很牢固，孔位间距足够，不怕同时插两三孔会打架，U充电孔真的很方便实用，以后还会光顾的。,5
159,设计很好，开关很流畅，很舒服，但是当插入大插头时（三脚插头）会有点卡位的感觉，，其他感觉都很好，充电口也很好,5
160,"很不错，精美，也很实用，买来当充电器的，价格比充电器还便宜，还可以当插座用，值了!
只是线太短了，太短了，太短了，亲测1.7米，放不到沙发中间了",5
161,第一次使用小米带USB的排插，质量杠杠的，可以同时支持3台手机的充电，且充电速度很快，大品牌就是不一样，线路质量很好，有安全保障，价格很优惠，我很满意，全五星好评?,5
162,很方便的一个插排，第一，不占地方，放在柜子边上就可以了。第二，外观好看，黑色很大气。第三，功能齐全，三个五孔的，三个数据线接口的，电源稳定。买了两个，真心不错。,5
163,这个插座非常好用，带了3个U**口，手机，相机可以同时充电，不用带好几个充电头了，做工精致，出去玩儿带着，更显出优势！,5
164,非常高端大气的插电板，外表简洁，插口比较多，放家里使用非常适合了。京东的快递非常给力，昨天买今天就到，最幸福的事情就是早上被京东快递员的电话叫醒了。,5
165,很不错，用了一段时间了，还是小米的插线板好用，用来冲小米手机，冲充电宝等等，外观很好，质量不错。,5
166,刚刚拿到这款插线板。从整体设计来看，很有米家的风格。简约，大气。插口那一面是磨砂的，摸起来手感很好(没事别玩电哈)。目前还没有usb接口，充电速度如何。不过是米家的产品，应该充电速度过得去！,5
167,插排很好用，喜欢小米的东西，再配合小米单插座，就更好控制了，一个总开关，一个分管开关，搭配小米网关和小爱音响等各个智能组件，打造智能家居，非常不错~,5
168,扩展效果很不错，自带USB充电口，虽然是输出是5v2A，比不上快充，但好在方便，电压电流稳定。放在床头还是很不错的！,5
169,出差旅游带一个插线板很方便，手机pad之类的直接插USB口了，插头可以留给相机电脑用，不用担心冲突问题了。现在电子设备越来越多，没个插板，充电都是问题。,5
170,N次买小米家的东西了，从手环开始，路由器、智能插座、WiFi信号放大器等等，每次都很满意，这次也不例外，智能插排，手机上也能控制开关，省去了每次再去开关的功夫，颜值也在线，满意,5
171,一米长的线  开关按钮有灯 晚上插排在地上不容易绊倒 很好用 白色也很好看 很喜欢的插排 用到现在没有质量问题,5
172,好用，基本上，青米给米家做的这个插座，是我家必备的插错了，放在床头充电用，很好用，颜值也比较高，给五星好评吧！?,5
173,小米简洁的设计延续到每一款产品之中，简单，整洁，大方，很不错的产品。还是儿童防止触电的设计，老公专门用一次性筷子倒倒，倒不开，插销轻松一下就插进去了，不错的设计，放在屋里每一处都不会显得突兀！以后还会继续支持小米的！京东物流也很快,5
174,常见的包装，算是比较经济的一种了，主要是网线够长，一般的家庭室内连线够用了，一次性成型的水晶头，接线上应该不会有什么问题，总之--对于一般的家庭、办公网络连线，非常的够用了。,5
175,小米现在真的好强大，去体验店看了一下，觉得这个插线板真不错，比一般的插线板瘦，还有三个USB口，特别实用，也很美观，喜欢喜欢?,5
176,小米的插排真的是很不错呢，这一款设计，简洁大方，通体白色的，做工很不错，也很结实，表面看不到衔接处，而且是新国标的，放在床头上用很方便，不需要，太长的线，嗯，很合适啊，这一款，还有独立的开关。,5
177,非常好用，美观大方，适合新一代的家居生活装修，清清爽爽，买了3个了，还2个小的，放床头柜，都非常好用，省心,5
178,小米插线板真的很好，三个U**插口，还有三个三相的，嗯，很好，用，但是没有，西蒙的插座的好差感觉，插口色色的,5
179,最近时来运转，网购都靠谱，这个放心买咯~小狗吸尘器+野兽派+小米插线板，特此点名表扬，小狗续航很长，每天需要的地方吸分把钟，差不多半个月才充一次电，服务还特别好，。过节送给麻麻的野兽派到货及时，精美，虽然贵点，但是麻麻也以为几十块，哈哈哈，她开心就好。小米插线板也很好线够长,5
180,小米的品质，做工都很好，这个插盘也很方便，有快充的功能，给手机充电的时候不用去专门找充电头了。插头的位置有的有米标，有的没有，客服说是生产批次不用。先试用，用的好以后再来回购。,5
181,非常棒啊特别好用，三个usb插口， 我可以插风扇，灯。宿舍神器啊，颜值也不错，超级棒，做工很好。很满意的一次用户体验,5
182,终于收到我需要的宝贝了，东西很好，价美物廉，满意的一次购物。无论是服务的态度还是对物品，我都非常满意的。客服态度很专业热情，有问必答，回复也很快，我问了不少问题，他都不觉得烦，都会认真回答我，这点我表示由衷的敬意。再说宝贝，正是我需要的，收到的时候包装完整，打开后让我惊喜的是，宝贝比我想象中的还要好！不得不得竖起大拇指。下次需要的时候我还会再来的。,5
183,买这个插排主要是给usb3.0分线器供电的，正好小米的usb是输出5V2A，配合山泽的分线器太完美！,5
184,之前的坏掉了 很喜欢小米带usb这款插线板 黑色很时尚 霸气 很喜欢 现在什么东西都喜欢在京东商城上购买 方便快捷 不管买什么基本第二天就会送到了 实在太方便了 适合我这种懒人。。。,5
185,看吧，就是这样子，白白净净的很喜欢，插孔也多，非常合适我在宿舍用，喜欢！,5
186,这玩意挺有份量感，线挺粗实的，给予一种安全的感觉。最美的插线板有木有？??三个usb接口着实很方便，充一下电子配件稳稳**，充手机速度就略慢了，还是老老实实用原装把哈哈,5
187,小米插排，买过好几个了 非常好用，单冲很快，三个一起充就比较慢了，但是很方便，也很美观！真的很不错，要是usb功率再能提高点就完美了！带防护，不怕孩子往里插东西了！,5
188,小巧可爱，漂亮又好用，放客厅沙发上充电用，还有三个usb口，很方便,5
189,小米五孔插座质量非常好，做工精细，有防护措施，插孔带有安全保护盖，内部做工用料非常好，带有安全保护措施，使电器产品能够安全使用。,5
190,非常好用的插线板，充手机很快，完全够用，关键是电器功率过高插线板会自动跳闸，用取暖片会跳，很安全的感觉。,5
191,这是买的第二个了，之前买了一个白色，非常好用，开关上有个白色的小灯，非常柔和，很有质感，有三个u**插口，和三个电源插口，足够用了。,5
192,不错，东西看着很精细，用着同想要的一样，有定时控制和遥控，还能统计用电量，很好，以后控制设备就方便了，好评,5
193,颜值很高，三个插口够用了，两台1060的本子完全可以带动，而且三个USB接口可以给电子书 蓝牙耳机什么的充电，还是十分方便的!,5
194,外观漂亮，做工精致，带usb口方便，插头很小巧，不影响同一面板其他插头一起使用，线很粗很软，总体非常满意！,5
195,小米的小家电还是蛮好用的，之前买的是个白色的用了蛮久这次买了黑色的感觉也很霸气啊。充电多口多功能很喜欢。??????,5
196,出门应急买来用的，很给力，关键是有usb插口，解救了手机啊?  而且插排不大，不占很多空间，也能轻一些，比较方便。?,5
197,办公室使用，很方便，三根线三部手机，充电互不干扰，干净整洁，不用天天插拔充电器了，也不用来回带着充电器了,5
198,非常经典的小米设计，但大家都在说开关的手感不是太好，犹豫了很久，终于买下了，用起来还行，充电非常方便。小体积的设计，放在床头柜上也不会占用多余的地方。不错，很喜欢。,5
199,快递速度很快，昨天拍的，今天中午就到了，很满意，外观简洁大方，功能很强大很齐全，大家看了都说好，我也很喜欢，继续支持！,5
200,这个长条设计很合理，放在桌上不占空间，尤其适合放边边上，餐桌上办公桌上使用非常巧妙。,5
201,很好，很不错的一款插排，买了两次了，挺好的，简约大方得体，很好看，而且很好用，非常棒的一款产品，很不错，真的很不错，值得后来，值得体验，你没有看错，很好，包装很到位，京东物流依然很快。。,5
202,挺喜欢小米的东西，之前买了个电视盒子也还不错，最近家里真好插头不够，又要插电脑电源，又要充电，刚好看到这一款，完全契合我的需求，完美！,5
203,小米的接线板，第二次购买，感觉整个还是满艺术的感觉，上面的三个usb接口非常的实用。线还蛮长的,5
204,很好啊，看着很漂亮，高端～～～～～质量也挺好的，寝室里好多有我这充手机，usb也真的快充无误！！！ 快递也是专门的盒子超完整&hellip;&hellip;&hellip;&hellip;&hellip;&hellip;&hellip;&hellip;&hellip;快递很快，在本地就有仓库，很方便，一天就到，正好解决我缺插座的紧急～～～～～～～～～～最后啊，很棒很棒！！！会回购！！！！！！！！,5
205,质量忒好！拿在手里十分的秀气，大概1.8米长的电线！发货速度也快！插入的感觉很不错，一点不生瑟&hellip;哈哈&hellip;&hellip;非常实用的设计！！,5
206,整体还是不错的，线不是很长，之前用的插板，老化了，插口接触不良，真心怕，赶紧换一个好一点的，这个带USB插口，手机充电都不用那么麻烦了，很喜欢。赞一个，物流也快，选的自提，49元免邮费，哈哈,5
207,总体来说很不错，外形尺寸小巧，很给力，电线在可以接受的范围内，总体来说是一次满意的购物，不错不错不错，喜欢的朋友可以参考，插座的外形比较有设计感，希望可以用的长久，习惯性全五星好评。希望品牌能一如既往做的好，不错不错不错不错不错不错不错&hellip;~~~。,5
208,单控功能，还带指示灯！usb接口也很方便实用！电压目前观察也比较稳！,5
209,很斯文很小巧的样子，很好用。开关也是小小的，插头也是小小的，不占地方。USB接口充电的时候，能听到一点小小的电流声，哈哈哈哈哈哈哈哈哈哈哈哈哈哈哈哈哈哈,5
210,好小巧，好苗条。黑色的很喜欢哦?喜欢小米家的东西。很好用。棒棒的哦。点赞?信赖京东，几乎每个礼拜都从京东买东西。家用大件小件，大到家具小到纸巾，多的都数不过来。家里的每个角落里都能见到，从京东买的东西。物流快，东西也值得信赖，产品质量有保障。服务态度也好，经常会有些活动。快递小哥服务态度好，快递也快，只要是晚上十点之前下单，第二天都能到，省去了很多的麻烦。如不喜欢或者是有质量问题，快递带着新的来换旧的，真心的很贴心。,5
211,京东网首选，方便快捷，质量保证，售后到位。价格合适，公司采购，很满意。这款图片没拍，直接交给申请的部门了。反映好评。,5
212,本插座设计上，加上了U**接口，整合了相关电子产品的充电功能，省去了携带、寻找充电器的不便，确实很棒！让我想起了铅笔和橡皮连在一起的故事&hellip;&hellip;,5
213,好快，不错，外观漂亮，客服也很好，有问必答，快递小哥点赞，早上就来电话，送到，产品到了，马上用上，用的好的话，还会回购的,5
214,做工精致，小巧，不那么占地方，线长1.5米，完全够用了，usb非常实用，中午不用再为找不到手机充电器头发愁了！,5
215,很赞，买了很多次了，安全放心，尤其是显示灯，不亮不暗，恰到好处，各种方面都设计的很细心，模样也超级好看，以后换新项目还会买这种插座,5
216,还没用，舍不得用啊，太美了，小白白的，从北方背到南方。分量还真是有的，没法子，用了小米就爱上小米。别的不说，既便宜又好看，更是欣慰的质量没问题。！,5
217,很好用，也很好看，非常喜欢。用来给加湿器，咖啡机，监控供电，有时候线太长看着烦，这样正好。,5
218,最想要的usb接口的，插小米的小凳当床头柜的特别好，之前都是用充电宝插的，很容易就没电了，现在一直放一晚上都可以，很开心。,5
219,对于电脑桌而言，电源其实不需要那么多，原来的接线板实在太大了，现在充电直接用USB 口，节约空间，很棒,5
220,经常没货，好不容易买到了，物流很快，插座也很好，安全插孔，电量监控，小爱同学语音控制，功能齐全很方便，以后家里都要用这样的插座！,5
221,第二个啦，很好用，方便，省了充电器啦，不过家里电子设备太多还是不够用的，呵呵呵,5
222,第二个，之前买个买来没几天按钮封就坏了，上网一查很多人中招，还有之前那一批很难插进去，现在这款已经改量，为什么之前那么差还买呢，便宜啊哈哈哈颜值也不错，充电还快！,5
223,用了一段时间 插线板很好用 放在书桌上 个USB口刚好重手机充电宝iPad 插座用来插台灯和笔记本电脑 还有总控开关 不用时关闭 安全便捷 小米的产品一向简洁大方美丽,5
224,小米插排外观简洁大方 做工很好 电源线够粗 插孔有防触电保护盖 u**口充电稳定  脚垫防滑 前前后后买过好几个了 都挺满意,5
225,一下子买了三个，第二天就到了，这速度非常满意！！拖线板颜值在线，还没有用，后面追评！,5
226,很不错，买来给草缸定时开灯，开增氧的，之前担心通过网络设置的这个会不稳定，前面还买了个按键设置的定时开关，用了这个觉得没出现不稳定，设置方便。插孔还多，要是可以每组分别设置时间就更好了,5
227,小米的忠实粉丝一枚，用过小米的电脑、无线鼠标、签字笔、充电宝，这次试一试小米的插板，试用下非常满意，设计时尚简约，也很安全,5
